{
  "$schema": "https://json-schema.org/draft/2020-12/schema",
  "$id": "recipe.schema.json",
  "title": "Project verification recipe (recipe.json)",
  "type": "object",
  "required": [
    "schema_version",
    "project",
    "status",
    "prerequisites",
    "launch",
    "doctor",
    "cleanup",
    "evidence",
    "features",
    "verified_run"
  ],
  "properties": {
    "schema_version": {
      "const": 1
    },
    "project": {
      "type": "string",
      "minLength": 1
    },
    "status": {
      "enum": [
        "draft",
        "verified"
      ]
    },
    "prerequisites": {
      "type": "array",
      "minItems": 1,
      "items": {
        "type": "string",
        "minLength": 1
      }
    },
    "variables": {
      "type": "object",
      "additionalProperties": {
        "type": "string"
      }
    },
    "launch": {
      "$ref": "#/$defs/launch"
    },
    "doctor": {
      "type": "array",
      "minItems": 1,
      "items": {
        "$ref": "#/$defs/cmd"
      }
    },
    "cleanup": {
      "type": "array",
      "minItems": 1,
      "items": {
        "$ref": "#/$defs/cmd"
      }
    },
    "evidence": {
      "type": "object",
      "required": [
        "dir",
        "expected"
      ],
      "properties": {
        "dir": {
          "type": "string",
          "minLength": 1
        },
        "expected": {
          "type": "array",
          "items": {
            "type": "string"
          }
        }
      }
    },
    "features": {
      "type": "array",
      "minItems": 1,
      "maxItems": 5,
      "items": {
        "type": "object",
        "required": [
          "id",
          "name",
          "doc",
          "steps",
          "expect"
        ],
        "properties": {
          "id": {
            "type": "string",
            "pattern": "^F-[A-Z0-9-]+$"
          },
          "name": {
            "type": "string",
            "minLength": 1
          },
          "doc": {
            "type": "string",
            "minLength": 1
          },
          "steps": {
            "type": "array",
            "minItems": 1,
            "items": {
              "$ref": "#/$defs/step"
            }
          },
          "expect": {
            "type": "array",
            "minItems": 1,
            "items": {
              "$ref": "#/$defs/expect"
            }
          }
        }
      }
    },
    "verified_run": {
      "type": [
        "object",
        "null"
      ]
    }
  },
  "additionalProperties": false,
  "$defs": {
    "launch": {
      "type": "object",
      "required": [
        "argv",
        "ready"
      ],
      "properties": {
        "argv": {
          "type": "array",
          "minItems": 1,
          "items": {
            "type": "string",
            "minLength": 1
          }
        },
        "cwd": {
          "type": "string"
        },
        "env": {
          "type": "object",
          "additionalProperties": {
            "type": "string"
          }
        },
        "ready": {
          "type": "object",
          "required": [
            "kind",
            "timeout_seconds"
          ],
          "properties": {
            "kind": {
              "enum": [
                "http",
                "file"
              ]
            },
            "url": {
              "type": "string"
            },
            "path": {
              "type": "string"
            },
            "timeout_seconds": {
              "type": "integer",
              "minimum": 1,
              "maximum": 300
            }
          }
        }
      }
    },
    "cmd": {
      "type": "object",
      "required": [
        "argv"
      ],
      "properties": {
        "argv": {
          "type": "array",
          "minItems": 1,
          "items": {
            "type": "string",
            "minLength": 1
          }
        },
        "purpose": {
          "type": "string"
        }
      }
    },
    "step": {
      "type": "object",
      "required": [
        "kind"
      ],
      "properties": {
        "kind": {
          "enum": [
            "http",
            "command"
          ]
        },
        "method": {
          "enum": [
            "GET",
            "POST",
            "PUT",
            "PATCH",
            "DELETE"
          ]
        },
        "url": {
          "type": "string"
        },
        "body": {},
        "argv": {
          "type": "array",
          "minItems": 1,
          "items": {
            "type": "string",
            "minLength": 1
          }
        },
        "capture": {
          "type": "string"
        }
      }
    },
    "expect": {
      "type": "object",
      "required": [
        "kind"
      ],
      "properties": {
        "kind": {
          "enum": [
            "status",
            "json_equals",
            "contains",
            "exit_code"
          ]
        },
        "step": {
          "type": "integer",
          "minimum": 1
        },
        "path": {
          "type": "string"
        },
        "equals": {},
        "text": {
          "type": "string"
        }
      }
    }
  }
}
