{
  "schema_version": 1,
  "project": "notes",
  "status": "draft",
  "prerequisites": [
    "python3"
  ],
  "variables": {
    "PORT": "free local port chosen at launch",
    "PID": "process id recorded at launch"
  },
  "launch": {
    "argv": [
      "python3",
      "app.py",
      "--port",
      "${PORT}"
    ],
    "ready": {
      "kind": "http",
      "url": "http://127.0.0.1:${PORT}/health",
      "timeout_seconds": 10
    }
  },
  "doctor": [
    {
      "argv": [
        "python3",
        "--version"
      ]
    }
  ],
  "cleanup": [
    {
      "argv": [
        "kill",
        "${PID}"
      ]
    }
  ],
  "evidence": {
    "dir": "evidence",
    "expected": [
      "created note is listed"
    ]
  },
  "features": [
    {
      "id": "F-CREATE",
      "name": "create note",
      "doc": "features/f-create.md",
      "steps": [
        {
          "kind": "http",
          "method": "POST",
          "url": "http://127.0.0.1:${PORT}/notes",
          "body": {
            "text": "hi"
          }
        }
      ],
      "expect": [
        {
          "kind": "status",
          "step": 1,
          "equals": 201
        }
      ]
    }
  ],
  "verified_run": null
}
